pid,guid,creationTime,days,content,nickname,productColor,referenceId,referenceName,referenceTime,score,userClient,userLevelId,userLevelName,userProvince,userRegisterTime
5853575,bb63512f-47f8-420c-a4c9-b3ca473bec39,2018-02-07 22:44:47,7,*，特意用了近十天才来评价。我89年的，2013年底才用上智能手机，京东买的华为荣耀3，速度慢但是质量好，用了三四年因为系统问题开不了机。到今年初京东买苹果se速度确实快，但是质量不好，才用半年天冷了现在总是自动关机，再很难开机。所以想买个手机，喜欢荣耀所以京东买了个荣耀9，用了一晚上速度很快，可是屏幕拖影严重，电池耗电也很快。我申请退货，京东服务很好上门来取走，第二天就退钱了。超赞！然后看中了这个荣耀v10，难抢，套餐购买近叁，千块。我舍不得，怕不好。因为看评价说屏幕国产也不好。我29岁单身，想省钱装修房子找对象。想买个荣耀8一千五凑合着用算了。纠结了好多天。还是忍不住买了荣耀v10，因为我有个华为平板m3，很喜欢前置指纹解锁按钮。收到机子我很喜欢，出厂自带贴膜很棒。屏幕大我手小也能拿住用，比一般六寸手机窄，手感很好可单手操作。前置指纹解锁也很快很好，最爱这个了。看评论说国产屏幕有斜纹，我的这个没看出来，屏幕很清晰，没问题。电池也很耐用，充满电，我第一天轻度使用，到晚上还有96％的电。后来中度使用，,N***n,幻夜黑,5853593,荣耀 V10 高配版 6GB+64GB 沙滩金 移动联通电信4G全面屏游戏手机 双卡双待,2018-01-31 13:12:10,5,2,105,PLUS会员,,
5853575,2a0973e7-af64-4fde-8a17-f59ad3170cfb,2017-12-12 19:52:33,0,"首先是好评送货速度，12号凌晨下单当天下午就到了。然后手机的外观的确挺好看，比想象中更加修长。包括裸机的手感,后壳金属质感很好个人认为，但是也的确有点收集指纹，目前运行起来没有太大问题。耳机接口也没有给人太粗糙的感觉。送的手机壳虽然一般，但是还是比较好的把凸出的摄像头遮住了。关于外观只有这些，因为刚刚拿到手机，在升级系统，包括人脸识别等等。所以还没有感受到970的威力。后期会根据续航，拍照，音质，一些细节的方面吧。进行追加，希望能帮助到有用的人",你***说,幻夜黑,5924244,荣耀 V10 高配版 6GB+64GB 沙滩金 移动联通电信4G全面屏游戏手机 双卡双待,2017-12-12 00:00:33,5,4,62,金牌会员,,
5853575,71425f6d-6c66-4644-b149-9ae420326ff5,2018-01-17 13:18:40,22,用了十多天才来评论，有一点不满意的是，手机拆开后，居然手机屏幕很多尘，还有包手机的塑料套也磨花了，我真的很怀疑是退换机，总体来说这台手机速度真的很快，摄像头个人觉得不算很清，黑白的比较清楚，人脸识别很快，指纹也很快，买64G内存我比较后悔，应该在买大一点，手机通话声音很大，在公众场合聊电话也会听得到，之前一直是在用小米，现在换华为，屏幕也很清楚，没有网上说得那么差，总体很清晰，电池方面续航比较给力的充电在超级快充的情况下，真的很快，提醒一点就是，充电器有两个充电方式的，数据线插进去一截是普通充电，整个数据线插进去是超级快充，还有就是华为的碎屏保，为了这件事我电话费打不少，华为客服四个客服都无法回答我的问题，还有打很久才有人听，希望华为客服方面能效仿一下小米,jd_535417767,魅丽红,5924266,荣耀 V10 高配版 6GB+64GB 沙滩金 移动联通电信4G全面屏游戏手机 双卡双待,2017-12-26 00:06:19,4,4,105,钻石会员,,
5853575,84cdd106-c04c-4ff3-9749-b167e038b23d,2018-03-07 16:45:50,3,先去实体店看了下这款手机，红色的确实挺惊艳的！但是店里面128G的比京东要贵点，吓得我掉头就走了，回来在京东上看了看，然后才决定买4+64的，个人感觉够用了，手机到手后手感真的好，也很顺手，完全OK，用段时间再来追评吧。对了，我是男的，用红色贼骚！?,罗***-,魅丽红,5853581,荣耀 V10 高配版 6GB+64GB 沙滩金 移动联通电信4G全面屏游戏手机 双卡双待,2018-03-04 14:22:58,5,4,105,钻石会员,,
5853575,03c1814c-7f10-42f5-b880-0f6f81d86e3d,2018-03-01 14:38:07,3,内存大，外观好看，手感不错，我一直想买，买来后果然不错，运行也很快，很适合我们年轻人，颜色也好好。,小***l,幻夜黑,5853579,荣耀 V10 高配版 6GB+64GB 沙滩金 移动联通电信4G全面屏游戏手机 双卡双待,2018-02-26 20:07:20,5,4,62,金牌会员,,
5853575,6ffc8b89-776e-40ce-b3b8-7e0180770ad8,2017-12-13 13:40:01,1,东西很好，我之前用的是荣耀7i，现在的荣耀V10很给力。运行速度很快。笫一次在京东买，物流超快,j***k,极光蓝,5853573,荣耀 V10 高配版 6GB+64GB 沙滩金 移动联通电信4G全面屏游戏手机 双卡双待,2017-12-12 00:05:08,5,4,61,PLUS会员,,
5853575,0cc15d10-ec71-451d-bc8f-6702864f0be8,2018-01-10 14:22:14,5,买来用了4天，首先各项功能正常。就本人购买的这个机子可以说没有大问题。再就是玩王者，开高帧率确实达不到满帧。基本58左右，偶尔可能50左右。刚入手打字不好打，安装第三方输入法讯飞正常。昨天升级，听说打字好了。屏幕斜纹没有发现。白色背景文字下拉有拖影，跟网上说的一样，没强迫症，不影响。基本不怎么拍照，好不好看不懂。跑分21万左右。,1***4,沙滩金,5853575,荣耀 V10 高配版 6GB+64GB 沙滩金 移动联通电信4G全面屏游戏手机 双卡双待,2018-01-05 20:41:03,5,4,61,银牌会员,,
5853575,99f17547-8be7-4ea6-99a4-612226ce26e9,2018-03-03 16:18:46,1,很满意的一次大花钱，建议大家在京东自营上面买东西，又快，又好，，，，先用几天，稍后评价,j***d,魅丽红,5924266,荣耀 V10 高配版 6GB+64GB 沙滩金 移动联通电信4G全面屏游戏手机 双卡双待,2018-03-02 16:28:24,5,4,61,银牌会员,,
5853575,88a0757f-9498-4bc5-9f9e-e8b1a1a3f77b,2018-02-06 15:58:37,1,京东送货很快手机很快收到了 这个手机的指纹和人脸识别给我印象很深 手碰下立马打开屏幕 真的特别快 这个是我见过指纹最快的手机了 特别是全面屏还能做到正面指纹人脸识别的速度也是相当的快 一抬手就打开了 还有一个我要重点说 这个手机是可以双卡同时4G的 这个可以让两个卡信号都好 毕竟很多地方2g信号不如4g 对比我的华为p9可以看得到华为这几年的进步还是非常巨大的 体验有了非常明显的提升,B***3,幻夜黑,5853579,荣耀 V10 高配版 6GB+64GB 沙滩金 移动联通电信4G全面屏游戏手机 双卡双待,2018-02-05 18:16:28,5,4,105,钻石会员,,
5853575,10176600-d920-4b65-a349-016efb104c3d,2018-02-07 13:38:27,1,手机实物比照片更漂亮，速度杠杠滴！玩了一把王者用的李白五杀吓哭！荣耀玩荣耀杠杠滴。,j***6,幻夜黑,5853579,荣耀 V10 高配版 6GB+64GB 沙滩金 移动联通电信4G全面屏游戏手机 双卡双待,2018-02-06 14:14:14,5,4,61,银牌会员,,
5853575,0d4522ac-31ce-47a3-ab87-b1406040eda9,2018-02-04 07:52:41,7,手机很不错，买给父亲用的。,大***8,幻夜黑,5853593,荣耀 V10 高配版 6GB+64GB 沙滩金 移动联通电信4G全面屏游戏手机 双卡双待,2018-01-28 00:04:28,5,4,62,金牌会员,,
5853575,68efd812-3cec-479e-beab-43caa422edd7,2018-06-06 20:35:35,1,第一次在京东买手机，谈一下个人感受，去年夏天给老婆买了一部荣耀9高配版，配置，做工，颜值，系统等各方面都满意，唯一的遗憾是中了个三等奖，不过老婆不是手机重度使用者，所以也无妨了。今年6.18看优惠力度不错，果断下手了一部荣耀v10高配版，v10的硬件配置自不必我多说，大家都了解。晚上下单次日上午就收到了，拆开物流包装，里面的手机包装完好无缺，这点让我很高兴，因为早熟悉了荣耀的系统，所以下午很快就安装好了我常用的那些软件，每个软件都依次登录我的账号信息，再把我旧手机上的数据导入到新机里，一切就绪后开始体验，期间有多个程序使用时有卡顿，还出现过一次自动重启手机现象，然后和老婆的荣耀9进行同步对比，却发现打开同一个软件时的反应速度却没有9快，很疑惑，难道麒麟970还不如960？还是说因为新机头一天使用，机子消化不良？今天暂不下定论，用几天后再来追评，本人一直支持国产实业，希望华为不要让我再次有遗憾！,冯***9,极光蓝,5821455,荣耀 V10 高配版 6GB+64GB 沙滩金 移动联通电信4G全面屏游戏手机 双卡双待,2018-06-05 19:13:25,5,4,61,银牌会员,,
5853575,62b708ff-9621-4a8f-8f44-1a21874735e1,2017-12-26 12:44:03,1,手机反应很快，指纹秒解锁，人脸秒解锁，买的套装版，有半年的碎屏险，还赠送了一副荣耀耳机，性价比比较高。试了半天，总的感受：1.系统反应迅速，很流畅，麒麟970的确不错。2.屏幕整体显示效果很好，还有色彩调节。3.正面指纹解锁，还有home键，这个价位，这个配置，可能是唯一选择。缺点嘛，可以说近乎完美了，并无明显缺点。总体来说，非常值得拥有的一部手机，比动辄6.7千性价比高很多，省下将近*元给妈妈买台好点的洗衣机也不错啊！,-***_,幻夜黑,5853579,荣耀 V10 高配版 6GB+64GB 沙滩金 移动联通电信4G全面屏游戏手机 双卡双待,2017-12-25 11:14:29,5,4,105,PLUS会员,,
5853575,757993f6-c88f-43e3-92e3-d40470376788,2017-12-16 11:17:27,2,京东配货速度就是快，次日达。第一次用华为手机，上手感觉不错。昨晚专门去实体店看了mate10，超级厚，比带壳的v10还厚，屏幕也比标配版的mate长些。华为的指纹解锁超级快，语音唤醒功能好好玩。颜值还算挺好。从苹果阵营脱离出来，感觉发现了新世界，好好研究怎么使用先。听说好好评论有耳机奖哟～,_***_,幻夜黑,5924244,荣耀 V10 高配版 6GB+64GB 沙滩金 移动联通电信4G全面屏游戏手机 双卡双待,2017-12-14 10:08:28,5,2,62,金牌会员,,
5853575,24fe565e-5167-4074-9abe-a02712d99d06,2017-12-09 17:03:31,4,12月5日抢购到的，今天总算到了。屏幕大色彩艳丽，但是确实存在横纹现象在三千往上这个价位感觉不应该出现啊？速度很快，指纹识别器虽小但也能快速识别，人脸识别比较灵敏。总得来说还是很不错的，其他的以后再追评。,改***买,极光蓝,5853573,荣耀 V10 高配版 6GB+64GB 沙滩金 移动联通电信4G全面屏游戏手机 双卡双待,2017-12-05 10:09:24,5,4,62,金牌会员,,
5853575,7372e867-79e8-4934-a4cc-b9b2775be7cf,2017-12-18 15:45:28,6,感觉挺好的，速度也挺快的，指纹解锁特别快，这个面部解锁也太灵敏了我去，电量也很耐用充电又快，这麒麟970系统挺厉害的，唯一不足的就是什么都没有连耳机都没有有点心塞能送个耳机就好了。总体来说很好值得购买。,j***n,魅丽红,5924266,荣耀 V10 高配版 6GB+64GB 沙滩金 移动联通电信4G全面屏游戏手机 双卡双待,2017-12-12 00:29:16,5,2,62,金牌会员,,
5853575,be52e49e-0615-464f-ac1a-02ec0a69aee9,2018-03-09 09:00:46,2,物流快，灵敏度高，手感好，功能多多,刘***o,幻夜黑,5853579,荣耀 V10 高配版 6GB+64GB 沙滩金 移动联通电信4G全面屏游戏手机 双卡双待,2018-03-07 22:29:58,5,4,62,金牌会员,,
5853575,e2666c5b-972d-466f-85b7-f1e8e085b58e,2017-12-12 20:14:32,3,这是第三次在京东自营买受你，我的荣耀v10，我感觉非常不错，各种性能都很好，特意用了两天来评论。比我以前的苹果手机好用多了。安兔兔跑分17万左右。电池续航能力强，我原以为国产机不怎么样，现在看来真的不错。非常值得购买。,希***遇,幻夜黑,5924244,荣耀 V10 高配版 6GB+64GB 沙滩金 移动联通电信4G全面屏游戏手机 双卡双待,2017-12-09 09:22:40,5,2,62,金牌会员,,
5853575,5d35c914-d8cc-4a2f-99bd-d8e5ad5b635c,2018-01-31 23:07:01,1,今天刚开始用，用用再说吧！应该会不错的！一直用华为！没有让我失望过！过几天再来评论！,6***i,幻夜黑,5853579,荣耀 V10 高配版 6GB+64GB 沙滩金 移动联通电信4G全面屏游戏手机 双卡双待,2018-01-30 19:32:12,5,4,62,金牌会员,,
5853575,350dd16e-a717-449d-87cd-d4034f3061ea,2018-06-18 15:10:36,1,京东618实在没忍住，在617的夜晚买了拔草已久的荣耀v10送给妈妈。不到2500元，性价比感觉很不错。首先，外观v10魅力红和6p都很美有木有。v10和ipone6p长度和厚度一样，宽度略窄2mm，图四仔细看落在一起稍微能看出点6p的边边。其次，v10机身内存6g+64g，6p内存64g。第三，使用时长来说，本人6p2015年5月份买，使用到现在，内存差不多够用。速度还可以。当然不能更新到ios11。所以想着妈妈肯定也够用。使用年限如果能达到3年以上速度依然如初。那就是性价比之王了感觉。待考查。第四，图片清晰度来说，绿色是v10照的，紫色是6p照的。拍照时的清晰度和明亮度很明显有差别。保证拍照没有美化。第五，玩游戏来说。老公反馈。吃鸡刺激战场清晰度v10明显比6p好。更何况屏幕更大。速度差不多。第六，音效来说。个人感觉v10稍微清亮一些，6p声音圆润一些，各有所爱。最后，价格。v10。2479元；6p。5500元。总而言之。如果荣耀v10能在三年后甚至更长时间运行速度依然如初。不卡顿。那才是大家真正的心头好。加油哦。,1***1,魅丽红,5924266,荣耀 V10 高配版 6GB+64GB 沙滩金 移动联通电信4G全面屏游戏手机 双卡双待,2018-06-17 23:05:50,5,2,62,PLUS会员,,
5853575,e2666c5b-972d-466f-85b7-f1e8e085b58e,2017-12-12 20:14:32,3,这是第三次在京东自营买受你，我的荣耀v10，我感觉非常不错，各种性能都很好，特意用了两天来评论。比我以前的苹果手机好用多了。安兔兔跑分17万左右。电池续航能力强，我原以为国产机不怎么样，现在看来真的不错。非常值得购买。,希***遇,幻夜黑,5924244,荣耀 V10 高配版 6GB+64GB 沙滩金 移动联通电信4G全面屏游戏手机 双卡双待,2017-12-09 09:22:40,5,2,62,金牌会员,,
5853575,117dde0e-9c91-4c52-9a59-48947f1ced93,2017-12-14 14:00:33,9,刚推出的新品，性价比极高：麒麟970，AI人工智能，这就是关键。之前想买MATE10，没想到荣耀v10诞生，使用了几天了，感觉非常快，个人认为是各项性能综合的首选，配置高，速度快，待机也行，主要是信号好。所以，一直选择华为。,孝***母,幻夜黑,5853593,荣耀 V10 高配版 6GB+64GB 沙滩金 移动联通电信4G全面屏游戏手机 双卡双待,2017-12-05 11:17:38,5,4,105,PLUS会员,,
5853575,5d35c914-d8cc-4a2f-99bd-d8e5ad5b635c,2018-01-31 23:07:01,1,今天刚开始用，用用再说吧！应该会不错的！一直用华为！没有让我失望过！过几天再来评论！,6***i,幻夜黑,5853579,荣耀 V10 高配版 6GB+64GB 沙滩金 移动联通电信4G全面屏游戏手机 双卡双待,2018-01-30 19:32:12,5,4,62,金牌会员,,
5853575,350dd16e-a717-449d-87cd-d4034f3061ea,2018-06-18 15:10:36,1,京东618实在没忍住，在617的夜晚买了拔草已久的荣耀v10送给妈妈。不到2500元，性价比感觉很不错。首先，外观v10魅力红和6p都很美有木有。v10和ipone6p长度和厚度一样，宽度略窄2mm，图四仔细看落在一起稍微能看出点6p的边边。其次，v10机身内存6g+64g，6p内存64g。第三，使用时长来说，本人6p2015年5月份买，使用到现在，内存差不多够用。速度还可以。当然不能更新到ios11。所以想着妈妈肯定也够用。使用年限如果能达到3年以上速度依然如初。那就是性价比之王了感觉。待考查。第四，图片清晰度来说，绿色是v10照的，紫色是6p照的。拍照时的清晰度和明亮度很明显有差别。保证拍照没有美化。第五，玩游戏来说。老公反馈。吃鸡刺激战场清晰度v10明显比6p好。更何况屏幕更大。速度差不多。第六，音效来说。个人感觉v10稍微清亮一些，6p声音圆润一些，各有所爱。最后，价格。v10。2479元；6p。5500元。总而言之。如果荣耀v10能在三年后甚至更长时间运行速度依然如初。不卡顿。那才是大家真正的心头好。加油哦。,1***1,魅丽红,5924266,荣耀 V10 高配版 6GB+64GB 沙滩金 移动联通电信4G全面屏游戏手机 双卡双待,2018-06-17 23:05:50,5,2,62,PLUS会员,,
5853575,3581c8a2-7c12-4b71-a322-67dc330cd9bc,2017-12-15 22:10:31,10,期待了很久，等了很久，现在到手有点失望，感觉发布会的吹得有点过了。1不满意就是后盖感觉很空，里面不够饱满，薄薄的。2屏幕有斜纹3耳机孔实在惨不忍睹，这毛刺，感觉是人工钻的。4充电孔里面空空的，感觉不防水不防尘5电池也不算耐用，一般，勉强够一天6后盖感觉不是金属，中框才是7发布会的很多功能都没见着，感觉跟普通手机没啥区别，比如拍照出双胞胎，换背景，3D啥的，都没体现出AI的什么特别。机子玩荒野逃生居然偶尔会卡，我旧手机三星s6返倒没出现过。8还有面部识别速度慢，光线稍微差点都不行，感觉鸡肋，还有屏幕的信息隐藏功能，我看的时候基本是信息已隐藏，擦。总体说，失望。,s***i,幻夜黑,5853579,荣耀 V10 高配版 6GB+64GB 沙滩金 移动联通电信4G全面屏游戏手机 双卡双待,2017-12-05 11:26:59,5,4,105,钻石会员,,
5853575,2da388ec-cb2f-4004-86e1-aa89e3388014,2017-12-29 07:03:42,24,收到机子我很喜欢，出厂自带贴膜很棒。屏幕大我手小也能拿住用，比一般六寸手机窄，手感很好可单手操作。前置指纹解锁也很快很好，最爱这个了。看评论说国产屏幕有斜纹，我的这个没看出来，屏幕很清晰，没问题。电池也很耐用，充满电，我第一天轻度使用，到晚上还有96％的电。后来中度使用，到晚上还有70％多的电。处理器速度很快，不比苹果差，软件都是一点就开。相机也很好，比我的苹果se强多了，拍照很清晰，暗光拍摄效果也很好。自带的文件保密柜，应用锁，都非常实用，很好的保护隐私。左滑动聚合信息很人性化，稍后阅读，可以将网页等收藏以后看，很实用。还有关节双击屏幕，实现截屏很方便，还可以截长图。qq微信可以应用分身，同时各登录两个。总之各方面都很好推荐购买。缺点是，输入打字有问题，经常打错字，这个可以忍受。打电话信号可以。就是数据网络非常差，4G网络还是非常非常慢，比苹果差多了，这个实在不行。这是我这手机唯一也是最大的缺憾！,龙***枪,沙滩金,5924252,荣耀 V10 高配版 6GB+64GB 沙滩金 移动联通电信4G全面屏游戏手机 双卡双待,2017-12-05 10:08:18,5,4,105,钻石会员,,
5853575,edc93c87-60b8-44e8-bd37-818159540ddf,2018-01-24 10:57:40,2,很满意，喜欢面板是白色的，里面送了一个透明手机壳，但是没能包住摄像头，从新在网上买了一个，指纹解锁很快，开软件速度也很快，屏幕斜纹什么的完全没看出来，可能是我眼神不好吧，，总之很满意，没让我失望，另外，京东的服务还是很好，电话号码填错了，竟然能找到正确的打过来?配送很快，前一天晚上买，第二天上午就收到了,j***1,沙滩金,5853575,荣耀 V10 高配版 6GB+64GB 沙滩金 移动联通电信4G全面屏游戏手机 双卡双待,2018-01-22 09:03:30,5,4,61,银牌会员,,
5853575,9937d818-1f98-4c5b-913a-f7ce1500faa3,2017-12-25 22:55:41,6,19号早上下的单，商品页面显示预计31号之后才有货，物流一直显示采购中，等得我比较担心?。但是意外的是23号早晨起来一看发现已经发货啦?，从外省发过来第二天早上收到。用了两天，感觉真的很不错。屏幕够大，看着舒服。外观实在是很喜欢，机身、颜色很漂亮，配上了一个自己买的*块的黑色外壳（自带的总觉得不好看?），手感、颜值都没的说，而且加了壳之后，摄像头的凸起也不醒目了，我感觉反而有点像大眼萌?。性能不错，指纹解锁也很快。。。。。。关于网上好些人讲屏幕颗粒感什么的，买的时候也比较揪心，不过拿到手后，确实没发现屏幕有什么问题，我平时喜欢看看视频什么的，看习惯了平板，除了屏幕小一点，没觉得有什么不适应的，可能部分网友说得夸张了点吧。。。?目前手机还没有发现问题，出问题我还会及时反馈的??,1***p,幻夜黑,5853579,荣耀 V10 高配版 6GB+64GB 沙滩金 移动联通电信4G全面屏游戏手机 双卡双待,2017-12-19 10:08:03,5,4,61,银牌会员,,
5853575,2d540916-308e-4f9c-a435-b63f2809c357,2018-02-04 10:16:33,15,心仪已久，终于抢到了，使用体验很好，是我想要的(???)?表白我大荣耀?(?ˊ??ˋ)?666?红色版本漂亮的不像话，拍照体验极佳?&bull;??&bull;??等过几天在帮老公买一个蓝色的(???)?指纹超级灵敏了，大爱,J***儿,魅丽红,5853587,荣耀 V10 高配版 6GB+64GB 沙滩金 移动联通电信4G全面屏游戏手机 双卡双待,2018-01-20 00:59:27,5,2,105,钻石会员,,
5853575,a6bbba04-1861-4b69-86c9-7d80895ce059,2018-01-25 23:02:56,1,一个字:快！而且还真的是智慧手机！比之前用的手机都好！本来是帮人买的，但用了半天后直觉得比我现用的苹果6s p流畅多了，想换来用了！看来华为真心不错?,jd-lhh9898,沙滩金,5853575,荣耀 V10 高配版 6GB+64GB 沙滩金 移动联通电信4G全面屏游戏手机 双卡双待,2018-01-24 12:00:43,5,2,105,PLUS会员,,
5853575,4e6b6e39-5c85-43ce-b7d6-7f2436455bd9,2018-06-11 21:08:16,10,很喜欢这个手机啊，之前买过一部，都没摸熟就被我弄丢了，现在还心疼着，然后高中用到现在的手机实在是卡了，不能打游戏什么的，就又打白条买了一部，红色颜值真的超高的，感觉什么手机壳啊钢化膜啊都配不上它一样。这个就是耳机孔下下面，不大喜欢。电量问题的话，我白天上班一般有空就看看小说电视，五点下班后吃鸡打王者，看小说，听歌，是能用一天的，充电也快。用了一周多现在，出现过问题的话就是唱吧，卡过两次，不知道是手机问题还是软件问题，反正现在各方面还算满意，而且我之前的也是荣耀手机，登录账号的话之前买的字体可以继续用，开心，我喜欢28的字体，超好看的,蒹***晞,魅丽红,5853587,荣耀 V10 高配版 6GB+64GB 沙滩金 移动联通电信4G全面屏游戏手机 双卡双待,2018-06-01 01:12:06,5,4,62,PLUS会员,,
5853575,4b0d526f-a805-41ee-8f9a-b8d2183b1251,2017-12-19 17:17:13,7,第一次用华为荣耀手机，之前的oppo用了快三年了，一装软件就提示存储空间已满，忍受了很久，终于下定决心买个新手机，老婆说华为的手机很耐用，无意中发现了v10，被她的外观，配置，深深吸引，12月12日0点果断下手，不到几秒钟就抢到了，很好抢，这点很赞。早晨快递让取货，一查是我的情人来了，迫不及待的往邮局冲，真的没让我失望，运行速度很快，颜值爆表，不愧是神机。也没发现评论里说的屏幕显示不好，有格格。真的很满意，后续使用完再来追评哦。哈哈，推荐给大家哦,b***9,极光蓝,5821455,荣耀 V10 高配版 6GB+64GB 沙滩金 移动联通电信4G全面屏游戏手机 双卡双待,2017-12-12 00:00:58,5,4,105,钻石会员,,
5853575,a911432e-4f20-4128-8322-c63139e0c0b1,2018-06-13 20:42:30,1,买给我姐的，很棒，电池也挺耐用的，充电也快，暂时没什么问题，玩王者很流畅，帧率没看，我用的关羽都很流畅，好久没玩了，玩关羽生疏了，以前巅峰状态超过同段位99.79的关羽，平均评分10.0以上的，场场mvp，一局20分钟大约耗电5-8个点之间吧，继续测试，有问题再追评,记***天,魅丽红,5853581,荣耀 V10 高配版 6GB+64GB 沙滩金 移动联通电信4G全面屏游戏手机 双卡双待,2018-06-12 12:30:48,5,4,62,金牌会员,,
5853575,25585cfa-840a-41c5-8766-e9e29a7fc035,2017-12-22 17:12:38,1,手机已经收到，京东的速度没的说，我买的是4G/64G的版本，个人感觉4G和6G没有太大的区别。下面说说手机，速度很快，外观也很漂亮，就是耳机孔的做工太差了，还有毛刺呢！送的塑料壳是软的最普通的那种，需要自己另外买保护壳，因为摄像头太突出，没有保护壳真不知道怎么用（怕摄像头磕坏）。再说说卡槽，是金属加塑料，几千块钱的手机还再扣这点金属钱，有点太过分，这点抵制华为，希望改善。面部解锁很快，很好用，配合抬手亮屏，简直太完美了，这点必须赞?，个人感觉比苹果做的好。系统很流畅，发热也可以，背部比较均匀，没有特别高的温度，作为一名检测工程师，这点的赞?,l***0,极光蓝,5853591,荣耀 V10 高配版 6GB+64GB 沙滩金 移动联通电信4G全面屏游戏手机 双卡双待,2017-12-21 13:40:39,5,4,105,PLUS会员,,
